{
  "ticket": "DEMO-42",
  "pr": "https://example.invalid/pr/7",
  "head_sha": "3f8a1c2e9b7d4f60a1b2c3d4e5f60718293a4b5c",
  "base_sha": "9c0d1e2f3a4b5c6d7e8f90a1b2c3d4e5f6a7b8c9",
  "working_tree": {
    "state": "clean",
    "changes": []
  },
  "environment": "CI",
  "check": "validate workflow run",
  "result": "PASS",
  "timestamp": "2026-01-15T10:30:00Z",
  "limitations": [
    "Interface checks at 360 px only"
  ]
}
